{
  "schema_version": "0.1.0",
  "metadata": {
    "id": "reconstructed_garment",
    "name": "Reconstructed Garment",
    "category": "reconstructed_garment",
    "description": "3D garment and 2D pattern reconstructed by ReWeaver vision-geometry engine.",
    "created_at": "2026-09-16T14:49:03.614915+00:00",
    "updated_at": "2026-09-16T14:49:03.614915+00:00",
    "reconstruction_model": {
      "name": "ReWeaver",
      "version": "1.0.0",
      "checkpoint": "GCD_ori",
      "device": "cuda"
    }
  },
  "units": {
    "spatial_2d": "mm",
    "spatial_3d": "m",
    "angles": "degrees",
    "mass_density": "g/m2"
  },
  "materials": [
    {
      "id": "mat_cotton_twill",
      "name": "Reconstructed Cotton Twill",
      "stretch_warp": 15,
      "stretch_weft": 20,
      "bend_stiffness": 25,
      "thickness_mm": 0.65,
      "density_gsm": 220,
      "color": "#3b4252",
      "confidence": 0.8
    }
  ],
  "panels": [
    {
      "id": "panel_0",
      "name": "Panel 1 (Front)",
      "category": "body_front",
      "material_id": "mat_cotton_twill",
      "boundary": {
        "edges": [
          {
            "id": "edge_0_0",
            "name": "Edge 1",
            "kind": "polyline",
            "start": {
              "x": 14213.647849920335,
              "y": 8909.990919027678
            },
            "end": {
              "x": -16612.266138175528,
              "y": 9237.185717823877
            },
            "polyline_samples": [
              {
                "x": 13876.885859302547,
                "y": 18057.585746380937
              },
              {
                "x": 13118.053607016236,
                "y": 18009.827608863816
              },
              {
                "x": 12335.763008946742,
                "y": 17964.783499326586
              },
              {
                "x": 11484.08959881067,
                "y": 17879.82420947219
              },
              {
                "x": 10615.750208615282,
                "y": 17778.90662965001
              },
              {
                "x": 9676.729966537663,
                "y": 17619.52557972336
              },
              {
                "x": 8741.740031690937,
                "y": 17423.71672951822
              },
              {
                "x": 7773.798732943192,
                "y": 17190.26654860272
              },
              {
                "x": 6924.428355510486,
                "y": 17000.814749597794
              },
              {
                "x": 6139.613419588727,
                "y": 16869.216007594332
              },
              {
                "x": 5322.913518752671,
                "y": 16725.59504577134
              },
              {
                "x": 4535.807405760523,
                "y": 16515.6627927945
              },
              {
                "x": 3733.782346624878,
                "y": 16193.532477213466
              },
              {
                "x": 2958.4592128585996,
                "y": 15869.427438765342
              },
              {
                "x": 2347.8223727807404,
                "y": 15533.131161730125
              },
              {
                "x": 1757.108011948418,
                "y": 15232.64619205861
              },
              {
                "x": 1151.4620893631502,
                "y": 14962.963980804034
              },
              {
                "x": 495.4330705234895,
                "y": 14722.75304918594
              },
              {
                "x": -161.52766047249045,
                "y": 14454.264912965527
              },
              {
                "x": -792.5488364978577,
                "y": 14225.46821998867
              },
              {
                "x": -1370.2793792795376,
                "y": 14044.635162167197
              },
              {
                "x": -1960.0133704618656,
                "y": 13874.67523973828
              },
              {
                "x": -2518.2664002228703,
                "y": 13737.805300919035
              },
              {
                "x": -3050.130006940151,
                "y": 13632.839782411793
              },
              {
                "x": -3584.0672854612876,
                "y": 13526.71788370344
              },
              {
                "x": -4108.805504764291,
                "y": 13415.448816339676
              },
              {
                "x": -4629.071718510375,
                "y": 13254.4189214575
              },
              {
                "x": -5155.8329951841415,
                "y": 13093.130026593371
              },
              {
                "x": -5671.86370805166,
                "y": 12892.688359809654
              },
              {
                "x": -6167.478412952164,
                "y": 12632.170856836638
              },
              {
                "x": -6691.321075979545,
                "y": 12384.00996333121
              },
              {
                "x": -7229.901202768701,
                "y": 12212.261360275761
              },
              {
                "x": -7768.948259102785,
                "y": 12144.668444798072
              },
              {
                "x": -8278.193902020575,
                "y": 12087.484167092725
              },
              {
                "x": -8770.813691636817,
                "y": 12033.773893840134
              },
              {
                "x": -9265.5468238288,
                "y": 11904.568165754426
              },
              {
                "x": -9759.353392705067,
                "y": 11757.247030480357
              },
              {
                "x": -10234.588568509253,
                "y": 11621.646556361384
              },
              {
                "x": -10707.180850131408,
                "y": 11431.270625965453
              },
              {
                "x": -11250.769525867327,
                "y": 11186.632375407044
              },
              {
                "x": -11800.424637800234,
                "y": 10913.780150288858
              },
              {
                "x": -12350.077317808427,
                "y": 10640.929141133029
              },
              {
                "x": -12883.029970811322,
                "y": 10360.35798697526
              },
              {
                "x": -13357.431604420071,
                "y": 10052.72376662822
              },
              {
                "x": -13827.011947284973,
                "y": 9770.803502235822
              },
              {
                "x": -14319.62991295768,
                "y": 9653.160360198854
              },
              {
                "x": -14847.099791694745,
                "y": 9543.503658919917
              },
              {
                "x": -15436.941243550336,
                "y": 9437.164102949737
              },
              {
                "x": -16025.58983633412,
                "y": 9334.836006793921
              },
              {
                "x": -16612.266138175528,
                "y": 9237.185717823877
              }
            ],
            "confidence": 0.999
          },
          {
            "id": "edge_0_1",
            "name": "Edge 2",
            "kind": "polyline",
            "start": {
              "x": -16612.266138175528,
              "y": 9237.185717823877
            },
            "end": {
              "x": -22034.84053965485,
              "y": -22697.564343239264
            },
            "polyline_samples": [
              {
                "x": 22578.53622007815,
                "y": -20243.448317067305
              },
              {
                "x": 21646.722378906816,
                "y": -20274.06989709311
              },
              {
                "x": 20702.116613744238,
                "y": -20289.83849693327
              },
              {
                "x": 19759.87711132757,
                "y": -20303.086406808234
              },
              {
                "x": 18935.388971597604,
                "y": -20335.002986743802
              },
              {
                "x": 18120.326972055864,
                "y": -20369.21773553331
              },
              {
                "x": 17299.596156007738,
                "y": -20402.69561113473
              },
              {
                "x": 16408.21306319276,
                "y": -20452.345786078695
              },
              {
                "x": 15476.46245206397,
                "y": -20517.370589059283
              },
              {
                "x": 14559.068708479344,
                "y": -20572.098622804333
              },
              {
                "x": 13648.965875184786,
                "y": -20621.18945506427
              },
              {
                "x": 12736.2256195388,
                "y": -20670.688850676015
              },
              {
                "x": 11807.983059808748,
                "y": -20760.468215311903
              },
              {
                "x": 10875.752143549107,
                "y": -20849.42558939474
              },
              {
                "x": 9933.446979165183,
                "y": -20905.999453997083
              },
              {
                "x": 8994.7842300204,
                "y": -20961.98479281884
              },
              {
                "x": 8020.735152355542,
                "y": -21015.754648226903
              },
              {
                "x": 6976.617459854992,
                "y": -21042.347744965355
              },
              {
                "x": 5954.0411484824745,
                "y": -21070.986090387578
              },
              {
                "x": 4954.7827392409545,
                "y": -21105.030604447165
              },
              {
                "x": 3981.7374385014546,
                "y": -21149.576169418197
              },
              {